Name_id,Name,Gender,Statement_of_reason,Activity-based,Profit_based,Status_based,Family-member_sanctions,Date_designated,Doc_num,Doc_title,Doc_url,Nationality,Regime_name,Designation_source,Unnamed: 15
457,nekrasova elena,female,"As a Judge of the Zavodsky district court in Minsk, Elena Nekrasova is responsible for the widespread sentencing of journalists, demonstrators and political activists in politically motivated decisions and without fair and transparent court proceedings. She therefore bears responsibility for undermining the rule of law and through her actions as a judge, she has contributed to the repression of civil society and democratic opposition.",1,0,0,0,18/02/2021,n.a.,UK Sanctions list,https://www.gov.uk/government/publications/the-uk-sanctions-list  ,n.a.,The Republic of Belarus (Sanctions) (EU Exit) Regulations 2019,UK,
458,hustyr yulia,female,"As a judge of the Central District Court of Minsk, Yulia Hustyr has been responsible the widespread sentencing of demonstrators and political activists (including opposition presidential candidate Viktor Babariko) in politically motivated decisions and without fair and transparent court proceedings. She therefore bears responsibility for undermining the rule of law and through her actions as a judge, she has contributed to the repression of civil society and democratic opposition, and a serious human rights violation.",1,0,0,0,18/02/2021,n.a.,UK Sanctions list,https://www.gov.uk/government/publications/the-uk-sanctions-list  ,n.a.,The Republic of Belarus (Sanctions) (EU Exit) Regulations 2019,UK,
459,fedorova marina,female,"As a judge at the Minsk City Sovetsky District Court, Marina Fedorova has been responsible the widespread sentencing of demonstrators and political activists in politically motivated decisions and without fair and transparent court proceedings. She therefore bears responsibility for undermining the rule of law and through her actions as a judge, she has contributed to the repression of civil society and democratic opposition.",1,0,0,0,18/02/2021,n.a.,UK Sanctions list,https://www.gov.uk/government/publications/the-uk-sanctions-list  ,n.a.,The Republic of Belarus (Sanctions) (EU Exit) Regulations 2019,UK,
460,buguk natalia,female,"In her position as a judge at the Frunzensky District Court in Minsk, NATALIA BUGUK has been responsible for numerous politically motivated rulings against journalists, opposition activists and protesters. Violations of the right to a fair trial have been reported during trials that she has conducted.
BUGUK therefore is or has been involved in undermining democracy and the rule of law in Belarus, repressing civil society and the democratic opposition in Belarus, and for serious human rights violations in Belarus.",1,0,0,0,02/12/2021,n.a.,UK Sanctions list,https://www.gov.uk/government/publications/the-uk-sanctions-list  ,n.a.,The Republic of Belarus (Sanctions) (EU Exit) Regulations 2019,UK,
461,kasyanchyk alina,female,"In her former position as assistant prosecutor at the Fruzensky District Court in Minsk, Alina Sergeevna KASYANCHYK has represented the Lukashenko regime in politically motivated cases against journalists, activists and protesters.
In particular, she has prosecuted BelSat journalists Katsiaryna Bakhvalava (Andreyeva) and Darya Chultsova for live streaming peaceful protests, based on the unwarrented charges of “conspiracy” and “violating public order”. She has also prosecuted members of Belarusian civil society e.g. for taking parts in peaceful protests, and paying tribute to murdered protester Aliaksandr Taraikousky. She has consistently asked the judge for disproportionately long-term prison sentences.
KASYANCHYK therefore is or has been involved in undermining democracy and the rule of law in Belarus, repressing civil society and the democratic opposition in Belarus, and for serious human rights violations.",1,0,0,0,02/12/2021,n.a.,UK Sanctions list,https://www.gov.uk/government/publications/the-uk-sanctions-list  ,n.a.,The Republic of Belarus (Sanctions) (EU Exit) Regulations 2019,UK,
462,gladkaya lyudmila,female,"Lyudmila GLADKAYA is a propagandist of the Lukashenko regime. She is a journalist publishing in “Belarus Segodnya"", the official (state-owned) newspaper of the Presidential Administration. Her published opinions/articles and broadcasts are one of the main mouthpieces of state propaganda belittling and discrediting independent journalists and opposition supporters who seek to demonstrate evidence of serious human rights violations committed by the regime. There are recorded instances where she has interrogated persons and her journalism is specifically endorsed by the Lukashenko regime. 
GLADKAYA therefore is or has been involved in repressing civil society and democratic opposition in Belarus, and for serious human rights violations in Belarus.",1,0,0,0,02/12/2021,n.a.,UK Sanctions list,https://www.gov.uk/government/publications/the-uk-sanctions-list  ,n.a.,The Republic of Belarus (Sanctions) (EU Exit) Regulations 2019,UK,
463,bondarenko svetlana,female,"Svetlana Aleksandrovna BONDARENKO is an involved person under the Belarus (Sanctions) (EU Exit) Regulations 2019 on the basis of the following grounds: BONDARENKO is or has been responsible for, engaging in, providing support for, or promoting the repression of civil society or democratic opposition in Belarus and actions, policies or activities which undermine democracy or the rule of law in Belarus.",1,0,0,0,07/12/2023,n.a.,UK Sanctions list,https://www.gov.uk/government/publications/the-uk-sanctions-list  ,n.a.,The Republic of Belarus (Sanctions) (EU Exit) Regulations 2019,UK,
464,grakun tatyana,female,"Tatyana Alexandrovna GRAKUN is an involved person under the Belarus (Sanctions) (EU Exit) Regulations 2019 on the basis of the following grounds: GRAKUN is or has been responsible for, engaging in, providing support for, or promoting: (1) the repression of civil society or democratic opposition in Belarus and (2) actions, policies or activities which undermine democracy or the rule of law in Belarus.",1,0,0,0,07/12/2023,n.a.,UK Sanctions list,https://www.gov.uk/government/publications/the-uk-sanctions-list  ,n.a.,The Republic of Belarus (Sanctions) (EU Exit) Regulations 2019,UK,
465,kulik valentina,female,"Valentina Gennadevna KULIK is an involved person under the Belarus (Sanctions) (EU Exit) Regulations 2019 on the basis of the following grounds: KULIK is or has been responsible for, engaging in, providing support for, or promoting: (1) the repression of civil society or democratic opposition in Belarus and (2) actions, policies or activities which undermine democracy or the rule of law in Belarus.",1,0,0,0,07/12/2023,n.a.,UK Sanctions list,https://www.gov.uk/government/publications/the-uk-sanctions-list  ,n.a.,The Republic of Belarus (Sanctions) (EU Exit) Regulations 2019,UK,
466,zapasnik marina,female,"Marina Sviatoslavovna ZAPASNIK (hereafter ZAPASNIK) is an involved person under the Belarus (Sanctions) (EU Exit) Regulations 2019 on the basis of the following grounds: ZAPASNIK is or has been responsible for, engaging in, providing support for, or promoting: (1) the repression of civil society or democratic opposition in Belarus and (2) actions, policies or activities which undermine democracy or the rule of law in Belarus.",1,0,0,0,07/12/2023,n.a.,UK Sanctions list,https://www.gov.uk/government/publications/the-uk-sanctions-list  ,n.a.,The Republic of Belarus (Sanctions) (EU Exit) Regulations 2019,UK,
467,zenkevich valentina,female,"Valentina Nikolaevna ZENKEVICH is an involved person under the Belarus (Sanctions) (EU Exit) Regulations 2019 on the basis of the following ground: Valentina Nikolaevna ZENKEVICH is or has been responsible for, engaging in, providing support for, or promoting: (1)  the repression of civil society or democratic opposition in Belarus, and (2) actions, policies or activities which undermine democracy or the rule of law in Belarus.",1,0,0,0,07/12/2023,n.a.,UK Sanctions list,https://www.gov.uk/government/publications/the-uk-sanctions-list  ,n.a.,The Republic of Belarus (Sanctions) (EU Exit) Regulations 2019,UK,
468,cvijanovic zeljka,female,"Zeljka Cvijanovic, as President of Republika Srpska, is working with Milorad Dodik (also designated under the Bosnia and Herzegovina (Sanctions) (EU Exit) Regulations 2020) to undermine the territorial integrity,  international personality or constitutional order of Bosnia and Herzegovina, through enacting the unilateral transfer of state competencies from the Government of Bosnia and Herzegovina to Republika Srpska, signing into law the legislative steps to begin to degrade/destroy state institutions as well as establishing an independent tax authority, medical agency, and army in the Republika Srpska. Cvijanovic’s actions are unconstitutional and go against the central tenets of the Dayton Peace Agreement as well as undermine the state’s competences in security.

Previously 11th Prime Minister of Republika Srpska. She is a member of the Alliance of Independent Social Democrats party (SNSD/СНСД), also a member of the party’s Executive Board and its Main Board",1,0,0,0,11/04/2022,n.a.,UK Sanctions list,https://www.gov.uk/government/publications/the-uk-sanctions-list  ,n.a.,The Bosnia and Herzegovina (Sanctions) (EU Exit) Regulations 2020,UK,
469,sultana aozma,female,"We have reasonable grounds to suspect that Aozma SULTANA (“SULTANA”) is an involved person on the basis that SULTANA: 1. Has been involved in terrorist activity by: a. Making available funds and providing financial services for the purposes of terrorism by making available funds and providing financial services to “Gaza Now”, an organisation which promotes, encourages and supports Hamas and Palestinian Islamic Jihad, and to its founder Mustafa AYASH, and b. Supporting or assisting Mustafa AYASH, and Gaza Now, both persons whom it is reasonable to suspect SULTANA knew or believed were involved in promoting or encouraging terrorism; and 2. Is associated with persons who are or have been involved in terrorist activity, namely Mustafa AYASH, and Gaza Now.

We have reasonable grounds to suspect that at least the following entities are owned or controlled by SULTANA and are therefore also subject to the asset freeze on SULTANA: Al-Qureshi Executives (company number 138086160) and the Aakhirah Ltd (company number 06850415).",1,0,1,0,27/03/2024,n.a.,UK Sanctions list,https://www.gov.uk/government/publications/the-uk-sanctions-list  ,n.a.,The Counter-Terrorism (Sanctions) (EU Exit) Regulations 2019,UK,
470,djang tcheul,female,"Djang Tcheul Hy has been involved together with her husband Kim Yong Nam, her son Kim Su Gwang and her daughter-in-law Kim Kyong Hui in a pattern of deceptive financial practices which could contribute to the DPRK’s nuclear-related, ballistic missile-related or other weapons of mass destruction-related programmes. She was the owner of several bank accounts in the European Union which were opened by her son Kim Su Gwang in her name. She was also involved in several bank transfers from accounts from her daughter-in-law KIM Kyong Hui to bank accounts outside the European Union.

Associations with Kim Yong Nam, Kim Su Gwang, and Kim Kyong Hui",1,0,1,1,31/12/2020,n.a.,UK Sanctions list,https://www.gov.uk/government/publications/the-uk-sanctions-list  ,n.a.,The Democratic People's Republic of Korea (Sanctions) (EU Exit) Regulations 2019,UK,
471,ryang su,female,"Director of Pan Systems Pyongyang. Pan Systems Pyongyang has been designated for assisting in the evasion of sanctions imposed by the United National Security Council through the attempted sale of arms and related materiel to Eritrea. Pan Systems is also controlled by and works on behalf of the Reconnaissance General Bureau which has been designated by the United Nations.

Associations with Pan Systems, Glocom, International Servides Sdn Bhd, and International Global Systems Sdn Bhd",1,0,0,0,31/12/2020,n.a.,UK Sanctions list,https://www.gov.uk/government/publications/the-uk-sanctions-list  ,n.a.,The Democratic People's Republic of Korea (Sanctions) (EU Exit) Regulations 2019,UK,
472,kim kyong,female,"KIM Kyong Hui, a four-star general of the DPRK, has been involved together with her husband Kim Su Gwang, her father-in-law Kim Yong Nam and her mother-in-law Djang Tcheul Hy in a pattern of deceptive financial practices which could contribute to the DPRK’s nuclear-related, ballistic missile-related or other weapons of mass destruction-related programmes. She received several bank transfers from her husband Kim Su Gwang and father-in-law Kim Yong Nam, and transferred money to accounts outside the European Union in her name or the name of her mother-in-law, Djang Tcheul Hy.

Association with Tcheul Hy Djang, Yong Nam Kim and Su Gwang Kim",1,0,1,1,31/12/2020,n.a.,UK Sanctions list,https://www.gov.uk/government/publications/the-uk-sanctions-list  ,n.a.,The Democratic People's Republic of Korea (Sanctions) (EU Exit) Regulations 2019,UK,
473,stepanova olga,female,"In December 2007, an organised criminal group was involved in serious corruption through the misappropriation of the equivalent of $230m of Russian state property via a complex scheme involving a fraudulent tax rebate. STEPANOVA participated in the serious corruption through her approval of part of the fraudulent tax rebate. She was responsible for and her actions facilitated or provided support for the serious corruption. She transferred or converted, or facilitated the transfer or conversion of, the proceeds of the serious corruption and benefitted financially from the serious corruption.

Wife of Vladlen STEPANOV at the time of the serious corruption",1,0,1,1,26/04/2021,n.a.,UK Sanctions list,https://www.gov.uk/government/publications/the-uk-sanctions-list  ,n.a.,The Global Anti-Corruption Sanctions Regulations 2021,UK,
474,khimina yelena,female,"In December 2007, an organised criminal group was involved in serious corruption through the misappropriation of the equivalent of $230m of state property via a complex scheme involving a fraudulent tax rebate. KHIMINA participated in the serious corruption through her approval of part of the fraudulent tax rebate. She was responsible for and her actions facilitated or provided support for the serious corruption. She also transferred or converted, or facilitated the transfer or conversion of, the proceeds of the serious corruption.",1,0,0,0,26/04/2021,n.a.,UK Sanctions list,https://www.gov.uk/government/publications/the-uk-sanctions-list  ,n.a.,The Global Anti-Corruption Sanctions Regulations 2021,UK,
475,mayorova yulia,female,"In December 2007, an organised criminal group was involved in serious corruption through the misappropriation of the equivalent of $230m of Russian state property via a complex scheme involving a fraudulent tax rebate. MAYOROVA participated in the fraud through her involvement, in particular, in court processes based on fraudulent claims for damages, as the lawyer representing Makhaon. Her actions facilitated or provided support for the serious corruption.",1,0,0,0,26/04/2021,n.a.,UK Sanctions list,https://www.gov.uk/government/publications/the-uk-sanctions-list  ,n.a.,The Global Anti-Corruption Sanctions Regulations 2021,UK,
476,kosakova anna,female,"Anna KOSAKOVA is an involved person under the Global Anti-Corruption Sanctions Regulations 2021 on the basis that she has been involved in serious corruption. Specifically, KOSAKOVA has been responsible for or engaged in serious corruption or has facilitated or provided support for serious corruption or has concealed or disguised or has facilitated the concealment or disguise of serious corruption given that she received benefit from funds over $300m improperly diverted, allocated or granted from the Central Bank of Lebanon, whilst Riad Salameh was its Governor.",1,0,0,0,10/08/2023,n.a.,UK Sanctions list,https://www.gov.uk/government/publications/the-uk-sanctions-list  ,n.a.,The Global Anti-Corruption Sanctions Regulations 2021,UK,
477,hoayek marianne,female,"Marianne HOAYEK is an involved person under the Global Anti-Corruption Sanctions Regulations 2021 on the basis that she has been involved in serious corruption. Specifically, she has facilitated or provided support for serious corruption, or has profited financially or obtained any other benefit from serious corruption given that she received benefit from funds over $300m improperly diverted, allocated or granted from the Central Bank of Lebanon whilst Riad Salameh was its Governor.",1,1,0,0,10/08/2023,n.a.,UK Sanctions list,https://www.gov.uk/government/publications/the-uk-sanctions-list  ,n.a.,The Global Anti-Corruption Sanctions Regulations 2021,UK,
478,among anita,female,"Anita Annet AMONG is an involved person under the Global Anti-Corruption Sanctions Regulations 2021. Specifically, AMONG, whilst Speaker of Parliament of Uganda and Member of Parliament for Bukedea District, is or has been responsible for or engaged in serious corruption.",1,0,0,0,30/04/2024,n.a.,UK Sanctions list,https://www.gov.uk/government/publications/the-uk-sanctions-list  ,n.a.,The Global Anti-Corruption Sanctions Regulations 2021,UK,
479,kitutu mary,female,"Mary Goretti KITUTU is an involved person under the Global Anti-Corruption Sanctions Regulations 2021. Specifically, KITUTU, whilst serving as the Minister for Karamoja Affairs and MP for Manafwa District engaged in or facilitated serious corruption. Having been entrusted with or through her role in the grant or allocation of iron sheets intended for residents of the Karamoja region, she improperly diverted, granted, or allocated them for the benefit of others.",1,0,0,0,30/04/2024,n.a.,UK Sanctions list,https://www.gov.uk/government/publications/the-uk-sanctions-list  ,n.a.,The Global Anti-Corruption Sanctions Regulations 2021,UK,
480,nandutu agnes,female,"Agnes Nandutu is an involved person under the Global Anti-Corruption Sanctions Regulations 2021 on the basis that there are reasonable grounds to suspect that she, as a foreign public official, has been involved in serious corruption. Specifically, that NANDUTU, whilst State Minister for Karamoja Affairs, engaged in serious corruption by having a role in or supporting the improper diversion, grant or allocation of iron sheets for the benefit of others.",1,0,0,0,30/04/2024,n.a.,UK Sanctions list,https://www.gov.uk/government/publications/the-uk-sanctions-list  ,n.a.,The Global Anti-Corruption Sanctions Regulations 2021,UK,
481,dos santos isabel,female,"Isabel DOS SANTOS is an involved person within the meaning of the Global Anti-Corruption Regulations 2021 on the basis of the following grounds: DOS SANTOS is or has been involved in (1) being responsible for or engaging in serious corruption; (2) profiting financially or obtaining any other benefit from serious corruption. Specifically, DOS SANTOS, whilst head of Angolan state oil firm Sonangol, misappropriated more than 50 million GBP for her own financial benefit and, whilst director of the Angolan telecoms company Unitel SA, misappropriated more than 300 million GBP for her own financial benefit.",1,1,0,0,21/11/2024,n.a.,UK Sanctions list,https://www.gov.uk/government/publications/the-uk-sanctions-list  ,n.a.,The Global Anti-Corruption Sanctions Regulations 2021,UK,
482,lemberga liga,female,"Liga LEMBERGA is an involved person under the Global Anti-Corruption Sanctions Regulations 2021 on the basis of the following grounds: LEMBERGA is or has been involved in (1) facilitating or providing support for serious corruption; (2) profiting financially or obtaining any other benefit from serious corruption. Specifically, LEMBERGA has been involved in the bribery and misappropriation of her father, Aivars Lembergs.",1,1,1,1,21/11/2024,n.a.,UK Sanctions list,https://www.gov.uk/government/publications/the-uk-sanctions-list  ,n.a.,The Global Anti-Corruption Sanctions Regulations 2021,UK,
483,firtash lada,female,"Lada FIRTASH is an involved person within the meaning of the Global Anti-Corruption Sanctions Regulations 2021 on the basis of the following grounds: (1) FIRTASH is or has been involved in profiting financially or obtaining any other benefit from serious corruption. Specifically, FIRTASH has profited financially from the corruption of her husband, Dmitry FIRTASH; and (2) FIRTASH is associated with a person who is or has been involved in serious corruption, namely her husband Dmitry FIRTASH.",1,1,1,1,21/11/2024,n.a.,UK Sanctions list,https://www.gov.uk/government/publications/the-uk-sanctions-list  ,n.a.,The Global Anti-Corruption Sanctions Regulations 2021,UK,
484,pattni minal,female,"Minal PATTNI is an involved person within the meaning of the Global Anti-Corruption Sanctions regulations 2021 on the basis of the following ground: PATTNI is a member of, or associated with, a person who is or has been involved in serious corruption, namely her husband Kamlesh Pattni.",0,0,1,1,09/12/2024,n.a.,UK Sanctions list,https://www.gov.uk/government/publications/the-uk-sanctions-list  ,n.a.,The Global Anti-Corruption Sanctions Regulations 2021,UK,
485,monterroso gomez cinthia,female,"There are reasonable grounds to suspect that Cinthia Edelmira Monterroso Gómez (“Monterroso”) is an involved person within the meaning of the Global Anti-Corruption Sanctions Regulations 2021 on the basis of the following grounds: 
 
(1) Monterroso is or has been involved in serious corruption, by being responsible for or engaging in serious corruption by way of receiving a bribe. As a prosecutor in the Public Ministry (Ministerio Público, MP), a foreign public official performing a judicial or executive function, Monterroso was promoted to Head of Unit at the Special Prosecution Office Against Impunity (Fiscalía Especial contra la Impunidad, FECI). She received this advantage to induce her to perform a public function improperly, namely by intentionally undermining corruption investigations into the political elite that nominated her. 
 
(2) Monterroso is or has been involved in serious corruption, by being responsible for the investigation or prosecution of serious corruption and intentionally failing to fulfil that responsibility. As a prosecutor in the MP, a foreign public official performing a judicial or executive function, Monterroso was promoted to Head of Unit at the FECI. She received this advantage to induce her to perform a public function improperly, namely by intentionally undermining corruption investigations into the political elite that nominated her. 
 
(3) Monterroso is or has been involved in serious corruption by using threats and intimidation to interfere in a law enforcement or judicial process in connection with serious corruption. As a prosecutor in the MP, a foreign public official performing a judicial or executive function, Monterroso was promoted to Head of Unit at the FECI. She received this advantage to induce her to perform a public function improperly, namely by intentionally launching baseless legal challenges against noted journalists and judicial figures who had uncovered corruption in order to silence them.",1,1,0,0,02/04/2025,n.a.,UK Sanctions list,https://www.gov.uk/government/publications/the-uk-sanctions-list  ,n.a.,The Global Anti-Corruption Sanctions Regulations 2021,UK,
